{
  "schema_version": 1,
  "pipeline_version": "v6",
  "date": "2026-04-18",
  "entries": [
    {
      "run_id": "daily-2026-04-18-20260418033718.-7c547653",
      "step": "daily",
      "status": "started",
      "timestamp": "2026-04-18T03:37:18.329Z",
      "summary": "daily stage started"
    },
    {
      "run_id": "daily-2026-04-18-20260418033718.-7c547653",
      "step": "daily",
      "status": "success",
      "timestamp": "2026-04-18T03:37:41.035Z",
      "summary": "daily stage completed",
      "metrics": {
        "github_total": 8,
        "github_pending": 8,
        "github_removed_qualified": 112,
        "github_removed_duplicates": 0,
        "hf_total": 7,
        "hf_pending": 7,
        "hf_removed_qualified": 133,
        "hf_removed_duplicates": 0,
        "plan_github_multiplier": 3,
        "plan_github_targets": 0,
        "plan_hf_multiplier": 3,
        "plan_hf_targets": 0
      },
      "artifacts": [
        "raw_corpus.gh.json",
        "raw_corpus.hf.json",
        "2026-04-18.github.draft.json",
        "2026-04-18.hf.draft.json",
        "daily_temp_data/2026-04-18_unqualified_gh.json",
        "daily_temp_data/2026-04-18_unqualified_hf.json",
        "daily_temp_data/2026-04-18_pending_summaries.json"
      ],
      "plan_summary": {
        "generated_at": "2026-04-17T03:57:18.730Z",
        "github": {
          "deficit": 8,
          "limit_multiplier": 3,
          "focus": [
            "mlops_monitoring",
            "optimization_compilers",
            "security_safety",
            "data_tooling",
            "deployment_serving",
            "edge_embedded",
            "framework_core",
            "agents_workflows"
          ],
          "targeted": 6
        },
        "huggingface": {
          "deficit": 8,
          "limit_multiplier": 3,
          "focus": [
            "3d_reconstruction",
            "adversarial_attack",
            "adversarial_defense",
            "ai_ethics_risk_assessment",
            "ar_vr_interaction",
            "asr",
            "auto_evaluation_models",
            "avsr"
          ],
          "targeted": 8
        },
        "notes": [
          "GitHub categories needing coverage: mlops_monitoring, optimization_compilers, security_safety, data_tooling, deployment_serving, edge_embedded, framework_core, agents_workflows",
          "Hugging Face task gaps: 3d_reconstruction, adversarial_attack, adversarial_defense, ai_ethics_risk_assessment, ar_vr_interaction, asr, auto_evaluation_models, avsr"
        ]
      }
    }
  ]
}
