{
  "schema_version": 1,
  "pipeline_version": "v6",
  "date": "2026-07-07",
  "entries": [
    {
      "run_id": "daily-2026-07-07-20260707035421.-4d5045e5",
      "step": "daily",
      "status": "started",
      "timestamp": "2026-07-07T03:54:21.916Z",
      "summary": "daily stage started"
    },
    {
      "run_id": "daily-2026-07-07-20260707035421.-4d5045e5",
      "step": "daily",
      "status": "success",
      "timestamp": "2026-07-07T03:54:45.154Z",
      "summary": "daily stage completed",
      "metrics": {
        "github_total": 8,
        "github_pending": 8,
        "github_removed_qualified": 112,
        "github_removed_duplicates": 0,
        "hf_total": 6,
        "hf_pending": 6,
        "hf_removed_qualified": 134,
        "hf_removed_duplicates": 0,
        "plan_github_multiplier": 3,
        "plan_github_targets": 0,
        "plan_hf_multiplier": 3,
        "plan_hf_targets": 1
      },
      "artifacts": [
        "raw_corpus.gh.json",
        "raw_corpus.hf.json",
        "2026-07-07.github.draft.json",
        "2026-07-07.hf.draft.json",
        "daily_temp_data/2026-07-07_unqualified_gh.json",
        "daily_temp_data/2026-07-07_unqualified_hf.json",
        "daily_temp_data/2026-07-07_pending_summaries.json"
      ],
      "plan_summary": {
        "generated_at": "2026-07-05T04:07:33.794Z",
        "github": {
          "deficit": 8,
          "limit_multiplier": 3,
          "focus": [
            "mlops_monitoring",
            "optimization_compilers",
            "security_safety",
            "agents_workflows",
            "data_tooling",
            "edge_embedded",
            "framework_core",
            "deployment_serving"
          ],
          "targeted": 6
        },
        "huggingface": {
          "deficit": 8,
          "limit_multiplier": 3,
          "focus": [
            "3d_reconstruction",
            "adversarial_attack",
            "adversarial_defense",
            "ai_ethics_risk_assessment",
            "ar_vr_interaction",
            "auto_evaluation_models",
            "avsr",
            "bioinformatics_analysis"
          ],
          "targeted": 8
        },
        "notes": [
          "GitHub categories needing coverage: mlops_monitoring, optimization_compilers, security_safety, agents_workflows, data_tooling, edge_embedded, framework_core, deployment_serving",
          "Hugging Face task gaps: 3d_reconstruction, adversarial_attack, adversarial_defense, ai_ethics_risk_assessment, ar_vr_interaction, auto_evaluation_models, avsr, bioinformatics_analysis"
        ]
      }
    },
    {
      "run_id": "tri-worker-2026-07-07-20260707040057.-c8ca66d5",
      "step": "tri_worker",
      "status": "started",
      "timestamp": "2026-07-07T04:00:57.187Z",
      "summary": "tri worker started",
      "pending_path": "/home/runner/work/fanwan-ai.github.io/fanwan-ai.github.io/data/ai/modelswatch/daily_temp_data/2026-07-07_pending_summaries.json",
      "queue_size": 14,
      "limit": 300
    },
    {
      "run_id": "tri-worker-2026-07-07-20260707040057.-c8ca66d5",
      "step": "tri_worker",
      "status": "success",
      "timestamp": "2026-07-07T04:01:33.613Z",
      "summary": "tri worker completed",
      "pending_path": "/home/runner/work/fanwan-ai.github.io/fanwan-ai.github.io/data/ai/modelswatch/daily_temp_data/2026-07-07_pending_summaries.json",
      "artifacts": [
        "tri_cache.staging.json"
      ],
      "stats": {
        "pending_before": 14,
        "pending_after": 10,
        "attempted": 14,
        "succeeded": 4,
        "failed": 0,
        "skipped": 10
      },
      "tri_diagnostics": {
        "cache_hits": 0,
        "cache_misses": 4,
        "total": 4,
        "ok_count": 4,
        "json_path_count": 4,
        "seq_path_count": 1,
        "warnings_total": 6,
        "errors_total": 1,
        "elapsed_sec": 36.166,
        "started_at": 1783396857.3736444,
        "finished_at": 1783396893.539952,
        "persist_enabled": true,
        "persist_file": "data/ai/modelswatch/tri_cache.json"
      }
    },
    {
      "run_id": "apply-tri-2026-07-07-20260707040133.-a88676af",
      "step": "apply_tri_to_summary",
      "status": "started",
      "timestamp": "2026-07-07T04:01:33.830Z",
      "summary": "apply_tri_to_summary started",
      "staging_path": "/home/runner/work/fanwan-ai.github.io/fanwan-ai.github.io/data/ai/modelswatch/tri_cache.staging.json",
      "cache_path": "/home/runner/work/fanwan-ai.github.io/fanwan-ai.github.io/data/ai/modelswatch/summary_cache.json",
      "accepted": 4,
      "skipped": 10
    },
    {
      "run_id": "apply-tri-2026-07-07-20260707040133.-a88676af",
      "step": "apply_tri_to_summary",
      "status": "success",
      "timestamp": "2026-07-07T04:01:33.990Z",
      "summary": "apply_tri_to_summary completed",
      "merged": [
        "github:karakeep-app/karakeep",
        "github:gastownhall/gastown",
        "github:bradautomates/claude-video",
        "huggingface:ggml-org/embeddinggemma-300M-GGUF"
      ],
      "skipped": [
        {
          "canonical_id": "github:sindresorhus/awesome",
          "promptHash": "sha256:2724fb8aae725474927df4f6b45de69bae28d10fbcf1a45f9da35c228ebe25de",
          "reason": "status_not_ok"
        },
        {
          "canonical_id": "github:firecrawl/firecrawl",
          "promptHash": "sha256:c7e4aa98820e16c7276d36b08d3ff2847e8c76f1f7fed2060779f6d664d4af77",
          "reason": "status_not_ok"
        },
        {
          "canonical_id": "github:ruvnet/RuView",
          "promptHash": "sha256:264704fa16252af91a99234b706fa6c6ab4e08ff167445e47463e8bd66cd0d87",
          "reason": "status_not_ok"
        },
        {
          "canonical_id": "github:codecrafters-io/build-your-own-x",
          "promptHash": "sha256:f0cc453408c52590c9c95e035339467922e740d334a51760d2024391693233ee",
          "reason": "status_not_ok"
        },
        {
          "canonical_id": "github:freeCodeCamp/freeCodeCamp",
          "promptHash": "sha256:7ce99892d88148e7d5cae0b4fc07936e1c16cb26ec455fb4ce856749a954c941",
          "reason": "status_not_ok"
        },
        {
          "canonical_id": "huggingface:sentence-transformers/all-MiniLM-L6-v2",
          "promptHash": "sha256:8ca19d098c0d5ea46046da1c9f3b1a75106bb839b2c9e9dd8eef54e1c97f811a",
          "reason": "status_not_ok"
        },
        {
          "canonical_id": "huggingface:cross-encoder/ms-marco-MiniLM-L6-v2",
          "promptHash": "sha256:e870990c5b3a25ae59fcf44e1245c0641a539ed34ccc7b8fa7795cfff5731ee3",
          "reason": "status_not_ok"
        },
        {
          "canonical_id": "huggingface:google-bert/bert-base-uncased",
          "promptHash": "sha256:103bf1cded07197c1a0c664f6dcb115c0d0822e3d00b7dfad50034a8b7a28f29",
          "reason": "status_not_ok"
        },
        {
          "canonical_id": "huggingface:BAAI/bge-small-en-v1.5",
          "promptHash": "sha256:5ed6cb6fb5aa934e43677a957100253b7a8572eaddddcf9750de5c99dd45f1f3",
          "reason": "status_not_ok"
        },
        {
          "canonical_id": "huggingface:sentence-transformers/paraphrase-multilingual-MiniLM-L12-v2",
          "promptHash": "sha256:44bbd0a9704390ac4236b71663254047d3c457959e94c1f976bfeb2db4d5c489",
          "reason": "status_not_ok"
        }
      ],
      "unchanged": [],
      "backup": "/home/runner/work/fanwan-ai.github.io/fanwan-ai.github.io/data/ai/modelswatch/summary_cache.json.bak.2026-07-07T04-01-33-880Z.gz",
      "archive": "/home/runner/work/fanwan-ai.github.io/fanwan-ai.github.io/data/ai/modelswatch/tri_cache.archive/2026-07-07-apply-tri-2026-07-07-20260707040133.-a88676af.json.gz"
    }
  ]
}
