{
  "schema_version": 1,
  "pipeline_version": "v6",
  "date": "2026-06-08",
  "entries": [
    {
      "run_id": "daily-2026-06-08-20260608035031.-79459186",
      "step": "daily",
      "status": "started",
      "timestamp": "2026-06-08T03:50:32.070Z",
      "summary": "daily stage started"
    },
    {
      "run_id": "daily-2026-06-08-20260608035031.-79459186",
      "step": "daily",
      "status": "success",
      "timestamp": "2026-06-08T03:50:55.159Z",
      "summary": "daily stage completed",
      "metrics": {
        "github_total": 8,
        "github_pending": 8,
        "github_removed_qualified": 112,
        "github_removed_duplicates": 0,
        "hf_total": 6,
        "hf_pending": 6,
        "hf_removed_qualified": 134,
        "hf_removed_duplicates": 0,
        "plan_github_multiplier": 3,
        "plan_github_targets": 0,
        "plan_hf_multiplier": 3,
        "plan_hf_targets": 0
      },
      "artifacts": [
        "raw_corpus.gh.json",
        "raw_corpus.hf.json",
        "2026-06-08.github.draft.json",
        "2026-06-08.hf.draft.json",
        "daily_temp_data/2026-06-08_unqualified_gh.json",
        "daily_temp_data/2026-06-08_unqualified_hf.json",
        "daily_temp_data/2026-06-08_pending_summaries.json"
      ],
      "plan_summary": {
        "generated_at": "2026-06-07T04:02:57.482Z",
        "github": {
          "deficit": 8,
          "limit_multiplier": 3,
          "focus": [
            "data_tooling",
            "mlops_monitoring",
            "agents_workflows",
            "deployment_serving",
            "edge_embedded",
            "optimization_compilers",
            "security_safety",
            "framework_core"
          ],
          "targeted": 6
        },
        "huggingface": {
          "deficit": 8,
          "limit_multiplier": 3,
          "focus": [
            "3d_reconstruction",
            "adversarial_attack",
            "adversarial_defense",
            "ai_ethics_risk_assessment",
            "ar_vr_interaction",
            "asr",
            "auto_evaluation_models",
            "avsr"
          ],
          "targeted": 8
        },
        "notes": [
          "GitHub categories needing coverage: data_tooling, mlops_monitoring, agents_workflows, deployment_serving, edge_embedded, optimization_compilers, security_safety, framework_core",
          "Hugging Face task gaps: 3d_reconstruction, adversarial_attack, adversarial_defense, ai_ethics_risk_assessment, ar_vr_interaction, asr, auto_evaluation_models, avsr"
        ]
      }
    },
    {
      "run_id": "tri-worker-2026-06-08-20260608035711.-80140b20",
      "step": "tri_worker",
      "status": "started",
      "timestamp": "2026-06-08T03:57:11.859Z",
      "summary": "tri worker started",
      "pending_path": "/home/runner/work/fanwan-ai.github.io/fanwan-ai.github.io/data/ai/modelswatch/daily_temp_data/2026-06-08_pending_summaries.json",
      "queue_size": 14,
      "limit": 300
    },
    {
      "run_id": "tri-worker-2026-06-08-20260608035711.-80140b20",
      "step": "tri_worker",
      "status": "success",
      "timestamp": "2026-06-08T03:57:22.103Z",
      "summary": "tri worker completed",
      "pending_path": "/home/runner/work/fanwan-ai.github.io/fanwan-ai.github.io/data/ai/modelswatch/daily_temp_data/2026-06-08_pending_summaries.json",
      "artifacts": [
        "tri_cache.staging.json"
      ],
      "stats": {
        "pending_before": 14,
        "pending_after": 10,
        "attempted": 14,
        "succeeded": 4,
        "failed": 0,
        "skipped": 10
      },
      "tri_diagnostics": {
        "cache_hits": 0,
        "cache_misses": 4,
        "total": 4,
        "ok_count": 4,
        "json_path_count": 4,
        "seq_path_count": 0,
        "warnings_total": 9,
        "errors_total": 0,
        "elapsed_sec": 9.352,
        "started_at": 1780891032.6866229,
        "finished_at": 1780891042.038969,
        "persist_enabled": true,
        "persist_file": "data/ai/modelswatch/tri_cache.json"
      }
    },
    {
      "run_id": "apply-tri-2026-06-08-20260608035722.-32e13db7",
      "step": "apply_tri_to_summary",
      "status": "started",
      "timestamp": "2026-06-08T03:57:22.308Z",
      "summary": "apply_tri_to_summary started",
      "staging_path": "/home/runner/work/fanwan-ai.github.io/fanwan-ai.github.io/data/ai/modelswatch/tri_cache.staging.json",
      "cache_path": "/home/runner/work/fanwan-ai.github.io/fanwan-ai.github.io/data/ai/modelswatch/summary_cache.json",
      "accepted": 4,
      "skipped": 10
    },
    {
      "run_id": "apply-tri-2026-06-08-20260608035722.-32e13db7",
      "step": "apply_tri_to_summary",
      "status": "success",
      "timestamp": "2026-06-08T03:57:22.459Z",
      "summary": "apply_tri_to_summary completed",
      "merged": [
        "github:refactoringhq/tolaria",
        "github:RyanCodrai/turbovec",
        "github:microsoft/pg_durable",
        "huggingface:HauhauCS/Qwen3.6-35B-A3B-Uncensored-HauhauCS-Aggressive"
      ],
      "skipped": [
        {
          "canonical_id": "github:NousResearch/hermes-agent",
          "promptHash": "sha256:f95b7d1ddb9785b7a50dad29e80a27fa8f4c80d8d79387bf752a0545a41d0e30",
          "reason": "status_not_ok"
        },
        {
          "canonical_id": "github:ggml-org/llama.cpp",
          "promptHash": "sha256:5db168d83c4933d55effc73c033a98aa89bd1afdd00fdd8185aec6a9accfddaf",
          "reason": "status_not_ok"
        },
        {
          "canonical_id": "github:opencv/opencv",
          "promptHash": "sha256:89306a6a8f93001a07d717fb2b5f90252740c25a45e111e268cdef89e75df05d",
          "reason": "status_not_ok"
        },
        {
          "canonical_id": "github:TapXWorld/ChinaTextbook",
          "promptHash": "sha256:9038a6cd44e6f6c6a70432e1135ecfbd5ce0f246e46d0f7d1e9429101011654c",
          "reason": "status_not_ok"
        },
        {
          "canonical_id": "github:codecrafters-io/build-your-own-x",
          "promptHash": "sha256:f0cc453408c52590c9c95e035339467922e740d334a51760d2024391693233ee",
          "reason": "status_not_ok"
        },
        {
          "canonical_id": "huggingface:sentence-transformers/all-MiniLM-L6-v2",
          "promptHash": "sha256:8ca19d098c0d5ea46046da1c9f3b1a75106bb839b2c9e9dd8eef54e1c97f811a",
          "reason": "status_not_ok"
        },
        {
          "canonical_id": "huggingface:cross-encoder/ms-marco-MiniLM-L6-v2",
          "promptHash": "sha256:e870990c5b3a25ae59fcf44e1245c0641a539ed34ccc7b8fa7795cfff5731ee3",
          "reason": "status_not_ok"
        },
        {
          "canonical_id": "huggingface:google-bert/bert-base-uncased",
          "promptHash": "sha256:103bf1cded07197c1a0c664f6dcb115c0d0822e3d00b7dfad50034a8b7a28f29",
          "reason": "status_not_ok"
        },
        {
          "canonical_id": "huggingface:BAAI/bge-small-en-v1.5",
          "promptHash": "sha256:5ed6cb6fb5aa934e43677a957100253b7a8572eaddddcf9750de5c99dd45f1f3",
          "reason": "status_not_ok"
        },
        {
          "canonical_id": "huggingface:google/electra-base-discriminator",
          "promptHash": "sha256:b7a35829f521c4fdcddf87805ac9f16ebd258cc548173cdfb983730156ddf6b9",
          "reason": "status_not_ok"
        }
      ],
      "unchanged": [],
      "backup": "/home/runner/work/fanwan-ai.github.io/fanwan-ai.github.io/data/ai/modelswatch/summary_cache.json.bak.2026-06-08T03-57-22-350Z.gz",
      "archive": "/home/runner/work/fanwan-ai.github.io/fanwan-ai.github.io/data/ai/modelswatch/tri_cache.archive/2026-06-08-apply-tri-2026-06-08-20260608035722.-32e13db7.json.gz"
    }
  ]
}
