{
  "schema_version": 1,
  "pipeline_version": "v6",
  "date": "2026-05-30",
  "entries": [
    {
      "run_id": "daily-2026-05-30-20260530034901.-d11ef078",
      "step": "daily",
      "status": "started",
      "timestamp": "2026-05-30T03:49:01.254Z",
      "summary": "daily stage started"
    },
    {
      "run_id": "daily-2026-05-30-20260530034901.-d11ef078",
      "step": "daily",
      "status": "success",
      "timestamp": "2026-05-30T03:49:24.875Z",
      "summary": "daily stage completed",
      "metrics": {
        "github_total": 10,
        "github_pending": 10,
        "github_removed_qualified": 110,
        "github_removed_duplicates": 0,
        "hf_total": 5,
        "hf_pending": 5,
        "hf_removed_qualified": 135,
        "hf_removed_duplicates": 0,
        "plan_github_multiplier": 3,
        "plan_github_targets": 0,
        "plan_hf_multiplier": 3,
        "plan_hf_targets": 0
      },
      "artifacts": [
        "raw_corpus.gh.json",
        "raw_corpus.hf.json",
        "2026-05-30.github.draft.json",
        "2026-05-30.hf.draft.json",
        "daily_temp_data/2026-05-30_unqualified_gh.json",
        "daily_temp_data/2026-05-30_unqualified_hf.json",
        "daily_temp_data/2026-05-30_pending_summaries.json"
      ],
      "plan_summary": {
        "generated_at": "2026-05-29T04:01:41.358Z",
        "github": {
          "deficit": 8,
          "limit_multiplier": 3,
          "focus": [
            "mlops_monitoring",
            "optimization_compilers",
            "security_safety",
            "edge_embedded",
            "data_tooling",
            "deployment_serving",
            "framework_core",
            "agents_workflows"
          ],
          "targeted": 6
        },
        "huggingface": {
          "deficit": 8,
          "limit_multiplier": 3,
          "focus": [
            "3d_reconstruction",
            "adversarial_attack",
            "adversarial_defense",
            "ai_ethics_risk_assessment",
            "ar_vr_interaction",
            "asr",
            "auto_evaluation_models",
            "avsr"
          ],
          "targeted": 8
        },
        "notes": [
          "GitHub categories needing coverage: mlops_monitoring, optimization_compilers, security_safety, edge_embedded, data_tooling, deployment_serving, framework_core, agents_workflows",
          "Hugging Face task gaps: 3d_reconstruction, adversarial_attack, adversarial_defense, ai_ethics_risk_assessment, ar_vr_interaction, asr, auto_evaluation_models, avsr"
        ]
      }
    },
    {
      "run_id": "tri-worker-2026-05-30-20260530035529.-19492e39",
      "step": "tri_worker",
      "status": "started",
      "timestamp": "2026-05-30T03:55:29.147Z",
      "summary": "tri worker started",
      "pending_path": "/home/runner/work/fanwan-ai.github.io/fanwan-ai.github.io/data/ai/modelswatch/daily_temp_data/2026-05-30_pending_summaries.json",
      "queue_size": 15,
      "limit": 300
    },
    {
      "run_id": "tri-worker-2026-05-30-20260530035529.-19492e39",
      "step": "tri_worker",
      "status": "success",
      "timestamp": "2026-05-30T03:55:38.938Z",
      "summary": "tri worker completed",
      "pending_path": "/home/runner/work/fanwan-ai.github.io/fanwan-ai.github.io/data/ai/modelswatch/daily_temp_data/2026-05-30_pending_summaries.json",
      "artifacts": [
        "tri_cache.staging.json"
      ],
      "stats": {
        "pending_before": 15,
        "pending_after": 10,
        "attempted": 15,
        "succeeded": 5,
        "failed": 0,
        "skipped": 10
      },
      "tri_diagnostics": {
        "cache_hits": 0,
        "cache_misses": 5,
        "total": 5,
        "ok_count": 5,
        "json_path_count": 5,
        "seq_path_count": 0,
        "warnings_total": 11,
        "errors_total": 0,
        "elapsed_sec": 9.39,
        "started_at": 1780113329.4721582,
        "finished_at": 1780113338.8621747,
        "persist_enabled": true,
        "persist_file": "data/ai/modelswatch/tri_cache.json"
      }
    },
    {
      "run_id": "apply-tri-2026-05-30-20260530035538.-544c20d0",
      "step": "apply_tri_to_summary",
      "status": "started",
      "timestamp": "2026-05-30T03:55:39.163Z",
      "summary": "apply_tri_to_summary started",
      "staging_path": "/home/runner/work/fanwan-ai.github.io/fanwan-ai.github.io/data/ai/modelswatch/tri_cache.staging.json",
      "cache_path": "/home/runner/work/fanwan-ai.github.io/fanwan-ai.github.io/data/ai/modelswatch/summary_cache.json",
      "accepted": 5,
      "skipped": 10
    },
    {
      "run_id": "apply-tri-2026-05-30-20260530035538.-544c20d0",
      "step": "apply_tri_to_summary",
      "status": "success",
      "timestamp": "2026-05-30T03:55:39.319Z",
      "summary": "apply_tri_to_summary completed",
      "merged": [
        "github:DataTalksClub/data-engineering-zoomcamp",
        "github:run-llama/liteparse",
        "github:Biohub/esm",
        "github:cursor/plugins",
        "github:galilai-group/stable-worldmodel"
      ],
      "skipped": [
        {
          "canonical_id": "github:codecrafters-io/build-your-own-x",
          "promptHash": "sha256:f0cc453408c52590c9c95e035339467922e740d334a51760d2024391693233ee",
          "reason": "status_not_ok"
        },
        {
          "canonical_id": "github:DigitalPlatDev/FreeDomain",
          "promptHash": "sha256:e568850da24376a7382492295c5e8f2b760e52896f84e2bd991121a5da0a43ac",
          "reason": "status_not_ok"
        },
        {
          "canonical_id": "github:anthropics/claude-code",
          "promptHash": "sha256:c146ed5ca37e5d0bda02deab9e76fa7a707548427b4d4494db2e2f05c9c91acd",
          "reason": "status_not_ok"
        },
        {
          "canonical_id": "github:microsoft/markitdown",
          "promptHash": "sha256:7616999e535914efd4659f405a035ca22f9fb94114b22bea24a473a8fe2b86ac",
          "reason": "status_not_ok"
        },
        {
          "canonical_id": "github:sindresorhus/awesome",
          "promptHash": "sha256:2724fb8aae725474927df4f6b45de69bae28d10fbcf1a45f9da35c228ebe25de",
          "reason": "status_not_ok"
        },
        {
          "canonical_id": "huggingface:sentence-transformers/all-MiniLM-L6-v2",
          "promptHash": "sha256:8ca19d098c0d5ea46046da1c9f3b1a75106bb839b2c9e9dd8eef54e1c97f811a",
          "reason": "status_not_ok"
        },
        {
          "canonical_id": "huggingface:google-bert/bert-base-uncased",
          "promptHash": "sha256:103bf1cded07197c1a0c664f6dcb115c0d0822e3d00b7dfad50034a8b7a28f29",
          "reason": "status_not_ok"
        },
        {
          "canonical_id": "huggingface:cross-encoder/ms-marco-MiniLM-L6-v2",
          "promptHash": "sha256:e870990c5b3a25ae59fcf44e1245c0641a539ed34ccc7b8fa7795cfff5731ee3",
          "reason": "status_not_ok"
        },
        {
          "canonical_id": "huggingface:google/electra-base-discriminator",
          "promptHash": "sha256:b7a35829f521c4fdcddf87805ac9f16ebd258cc548173cdfb983730156ddf6b9",
          "reason": "status_not_ok"
        },
        {
          "canonical_id": "huggingface:BAAI/bge-small-en-v1.5",
          "promptHash": "sha256:5ed6cb6fb5aa934e43677a957100253b7a8572eaddddcf9750de5c99dd45f1f3",
          "reason": "status_not_ok"
        }
      ],
      "unchanged": [],
      "backup": "/home/runner/work/fanwan-ai.github.io/fanwan-ai.github.io/data/ai/modelswatch/summary_cache.json.bak.2026-05-30T03-55-39-205Z.gz",
      "archive": "/home/runner/work/fanwan-ai.github.io/fanwan-ai.github.io/data/ai/modelswatch/tri_cache.archive/2026-05-30-apply-tri-2026-05-30-20260530035538.-544c20d0.json.gz"
    }
  ]
}
