{
  "schema_version": 1,
  "pipeline_version": "v6",
  "date": "2026-02-12",
  "entries": [
    {
      "run_id": "daily-2026-02-12-20260212033200.-0e6ee8d7",
      "step": "daily",
      "status": "started",
      "timestamp": "2026-02-12T03:32:00.410Z",
      "summary": "daily stage started"
    },
    {
      "run_id": "daily-2026-02-12-20260212033200.-0e6ee8d7",
      "step": "daily",
      "status": "success",
      "timestamp": "2026-02-12T03:32:23.233Z",
      "summary": "daily stage completed",
      "metrics": {
        "github_total": 7,
        "github_pending": 7,
        "github_removed_qualified": 113,
        "github_removed_duplicates": 0,
        "hf_total": 8,
        "hf_pending": 8,
        "hf_removed_qualified": 132,
        "hf_removed_duplicates": 0,
        "plan_github_multiplier": 3,
        "plan_github_targets": 0,
        "plan_hf_multiplier": 3,
        "plan_hf_targets": 1
      },
      "artifacts": [
        "raw_corpus.gh.json",
        "raw_corpus.hf.json",
        "2026-02-12.github.draft.json",
        "2026-02-12.hf.draft.json",
        "daily_temp_data/2026-02-12_unqualified_gh.json",
        "daily_temp_data/2026-02-12_unqualified_hf.json",
        "daily_temp_data/2026-02-12_pending_summaries.json"
      ],
      "plan_summary": {
        "generated_at": "2026-02-11T03:41:46.646Z",
        "github": {
          "deficit": 8,
          "limit_multiplier": 3,
          "focus": [
            "agents_workflows",
            "deployment_serving",
            "framework_core",
            "mlops_monitoring",
            "optimization_compilers",
            "security_safety",
            "data_tooling",
            "edge_embedded"
          ],
          "targeted": 6
        },
        "huggingface": {
          "deficit": 8,
          "limit_multiplier": 3,
          "focus": [
            "3d_reconstruction",
            "adversarial_attack",
            "adversarial_defense",
            "ai_ethics_risk_assessment",
            "ar_vr_interaction",
            "asr",
            "auto_evaluation_models",
            "avsr"
          ],
          "targeted": 8
        },
        "notes": [
          "GitHub categories needing coverage: agents_workflows, deployment_serving, framework_core, mlops_monitoring, optimization_compilers, security_safety, data_tooling, edge_embedded",
          "Hugging Face task gaps: 3d_reconstruction, adversarial_attack, adversarial_defense, ai_ethics_risk_assessment, ar_vr_interaction, asr, auto_evaluation_models, avsr"
        ]
      }
    },
    {
      "run_id": "tri-worker-2026-02-12-20260212033641.-c6a8f6f7",
      "step": "tri_worker",
      "status": "started",
      "timestamp": "2026-02-12T03:36:41.553Z",
      "summary": "tri worker started",
      "pending_path": "/home/runner/work/fanwan-ai.github.io/fanwan-ai.github.io/data/ai/modelswatch/daily_temp_data/2026-02-12_pending_summaries.json",
      "queue_size": 15,
      "limit": 300
    },
    {
      "run_id": "tri-worker-2026-02-12-20260212033641.-c6a8f6f7",
      "step": "tri_worker",
      "status": "success",
      "timestamp": "2026-02-12T03:37:02.263Z",
      "summary": "tri worker completed",
      "pending_path": "/home/runner/work/fanwan-ai.github.io/fanwan-ai.github.io/data/ai/modelswatch/daily_temp_data/2026-02-12_pending_summaries.json",
      "artifacts": [
        "tri_cache.staging.json"
      ],
      "stats": {
        "pending_before": 15,
        "pending_after": 10,
        "attempted": 15,
        "succeeded": 5,
        "failed": 0,
        "skipped": 10
      },
      "tri_diagnostics": {
        "cache_hits": 0,
        "cache_misses": 5,
        "total": 5,
        "ok_count": 5,
        "json_path_count": 5,
        "seq_path_count": 0,
        "warnings_total": 5,
        "errors_total": 0,
        "elapsed_sec": 20.043,
        "started_at": 1770867402.1671214,
        "finished_at": 1770867422.2100646,
        "persist_enabled": true,
        "persist_file": "data/ai/modelswatch/tri_cache.json"
      }
    },
    {
      "run_id": "apply-tri-2026-02-12-20260212033702.-def05ede",
      "step": "apply_tri_to_summary",
      "status": "started",
      "timestamp": "2026-02-12T03:37:02.448Z",
      "summary": "apply_tri_to_summary started",
      "staging_path": "/home/runner/work/fanwan-ai.github.io/fanwan-ai.github.io/data/ai/modelswatch/tri_cache.staging.json",
      "cache_path": "/home/runner/work/fanwan-ai.github.io/fanwan-ai.github.io/data/ai/modelswatch/summary_cache.json",
      "accepted": 5,
      "skipped": 10
    },
    {
      "run_id": "apply-tri-2026-02-12-20260212033702.-def05ede",
      "step": "apply_tri_to_summary",
      "status": "success",
      "timestamp": "2026-02-12T03:37:02.548Z",
      "summary": "apply_tri_to_summary completed",
      "merged": [
        "github:cheahjs/free-llm-api-resources",
        "github:github/gh-aw",
        "huggingface:Qwen/Qwen3-VL-235B-A22B-Thinking",
        "huggingface:nomic-ai/nomic-embed-text-v1",
        "huggingface:microsoft/wavlm-base-plus"
      ],
      "skipped": [
        {
          "canonical_id": "github:microsoft/PowerToys",
          "promptHash": "sha256:af02bfbac0fda3b29623d1afc22b99a0ab99be5a6bc217287f6115d95fd977dd",
          "reason": "status_not_ok"
        },
        {
          "canonical_id": "github:codecrafters-io/build-your-own-x",
          "promptHash": "sha256:f0cc453408c52590c9c95e035339467922e740d334a51760d2024391693233ee",
          "reason": "status_not_ok"
        },
        {
          "canonical_id": "github:freeCodeCamp/freeCodeCamp",
          "promptHash": "sha256:7ce99892d88148e7d5cae0b4fc07936e1c16cb26ec455fb4ce856749a954c941",
          "reason": "status_not_ok"
        },
        {
          "canonical_id": "github:sindresorhus/awesome",
          "promptHash": "sha256:2724fb8aae725474927df4f6b45de69bae28d10fbcf1a45f9da35c228ebe25de",
          "reason": "status_not_ok"
        },
        {
          "canonical_id": "github:public-apis/public-apis",
          "promptHash": "sha256:2f7e803145c8932a8d3a6af2351a8c66d6db19e0b3d661aba966423d3b32968f",
          "reason": "status_not_ok"
        },
        {
          "canonical_id": "huggingface:sentence-transformers/all-MiniLM-L6-v2",
          "promptHash": "sha256:8ca19d098c0d5ea46046da1c9f3b1a75106bb839b2c9e9dd8eef54e1c97f811a",
          "reason": "status_not_ok"
        },
        {
          "canonical_id": "huggingface:Falconsai/nsfw_image_detection",
          "promptHash": "sha256:99eb3455f132a5daa0b74321d39efa65c6809414abe9e770c4103364cd72c767",
          "reason": "status_not_ok"
        },
        {
          "canonical_id": "huggingface:google-bert/bert-base-uncased",
          "promptHash": "sha256:103bf1cded07197c1a0c664f6dcb115c0d0822e3d00b7dfad50034a8b7a28f29",
          "reason": "status_not_ok"
        },
        {
          "canonical_id": "huggingface:google/electra-base-discriminator",
          "promptHash": "sha256:b7a35829f521c4fdcddf87805ac9f16ebd258cc548173cdfb983730156ddf6b9",
          "reason": "status_not_ok"
        },
        {
          "canonical_id": "huggingface:dima806/fairface_age_image_detection",
          "promptHash": "sha256:ec0b6409340ca5062d0bc84b162ba7095cf7c565f51f8a3a56f5458334e73fbb",
          "reason": "status_not_ok"
        }
      ],
      "unchanged": [],
      "backup": "/home/runner/work/fanwan-ai.github.io/fanwan-ai.github.io/data/ai/modelswatch/summary_cache.json.bak.2026-02-12T03-37-02-478Z.gz",
      "archive": "/home/runner/work/fanwan-ai.github.io/fanwan-ai.github.io/data/ai/modelswatch/tri_cache.archive/2026-02-12-apply-tri-2026-02-12-20260212033702.-def05ede.json.gz"
    }
  ]
}
