{
  "schema_version": 1,
  "pipeline_version": "v6",
  "date": "2026-05-15",
  "entries": [
    {
      "run_id": "daily-2026-05-15-20260515034844.-5406c1db",
      "step": "daily",
      "status": "started",
      "timestamp": "2026-05-15T03:48:44.344Z",
      "summary": "daily stage started"
    },
    {
      "run_id": "daily-2026-05-15-20260515034844.-5406c1db",
      "step": "daily",
      "status": "success",
      "timestamp": "2026-05-15T03:49:07.204Z",
      "summary": "daily stage completed",
      "metrics": {
        "github_total": 7,
        "github_pending": 7,
        "github_removed_qualified": 113,
        "github_removed_duplicates": 0,
        "hf_total": 6,
        "hf_pending": 6,
        "hf_removed_qualified": 134,
        "hf_removed_duplicates": 0,
        "plan_github_multiplier": 3,
        "plan_github_targets": 0,
        "plan_hf_multiplier": 3,
        "plan_hf_targets": 0
      },
      "artifacts": [
        "raw_corpus.gh.json",
        "raw_corpus.hf.json",
        "2026-05-15.github.draft.json",
        "2026-05-15.hf.draft.json",
        "daily_temp_data/2026-05-15_unqualified_gh.json",
        "daily_temp_data/2026-05-15_unqualified_hf.json",
        "daily_temp_data/2026-05-15_pending_summaries.json"
      ],
      "plan_summary": {
        "generated_at": "2026-05-14T04:01:02.516Z",
        "github": {
          "deficit": 8,
          "limit_multiplier": 3,
          "focus": [
            "mlops_monitoring",
            "security_safety",
            "edge_embedded",
            "agents_workflows",
            "data_tooling",
            "optimization_compilers",
            "deployment_serving",
            "framework_core"
          ],
          "targeted": 6
        },
        "huggingface": {
          "deficit": 8,
          "limit_multiplier": 3,
          "focus": [
            "adversarial_attack",
            "adversarial_defense",
            "ai_ethics_risk_assessment",
            "ar_vr_interaction",
            "asr",
            "auto_evaluation_models",
            "avsr",
            "compilation_optimization"
          ],
          "targeted": 8
        },
        "notes": [
          "GitHub categories needing coverage: mlops_monitoring, security_safety, edge_embedded, agents_workflows, data_tooling, optimization_compilers, deployment_serving, framework_core",
          "Hugging Face task gaps: adversarial_attack, adversarial_defense, ai_ethics_risk_assessment, ar_vr_interaction, asr, auto_evaluation_models, avsr, compilation_optimization"
        ]
      }
    },
    {
      "run_id": "tri-worker-2026-05-15-20260515035449.-f74b1937",
      "step": "tri_worker",
      "status": "started",
      "timestamp": "2026-05-15T03:54:49.376Z",
      "summary": "tri worker started",
      "pending_path": "/home/runner/work/fanwan-ai.github.io/fanwan-ai.github.io/data/ai/modelswatch/daily_temp_data/2026-05-15_pending_summaries.json",
      "queue_size": 13,
      "limit": 300
    },
    {
      "run_id": "tri-worker-2026-05-15-20260515035449.-f74b1937",
      "step": "tri_worker",
      "status": "success",
      "timestamp": "2026-05-15T03:54:56.214Z",
      "summary": "tri worker completed",
      "pending_path": "/home/runner/work/fanwan-ai.github.io/fanwan-ai.github.io/data/ai/modelswatch/daily_temp_data/2026-05-15_pending_summaries.json",
      "artifacts": [
        "tri_cache.staging.json"
      ],
      "stats": {
        "pending_before": 13,
        "pending_after": 10,
        "attempted": 13,
        "succeeded": 3,
        "failed": 0,
        "skipped": 10
      },
      "tri_diagnostics": {
        "cache_hits": 0,
        "cache_misses": 3,
        "total": 3,
        "ok_count": 3,
        "json_path_count": 3,
        "seq_path_count": 0,
        "warnings_total": 3,
        "errors_total": 0,
        "elapsed_sec": 6.433,
        "started_at": 1778817289.7223494,
        "finished_at": 1778817296.1555264,
        "persist_enabled": true,
        "persist_file": "data/ai/modelswatch/tri_cache.json"
      }
    },
    {
      "run_id": "apply-tri-2026-05-15-20260515035456.-0bb5383d",
      "step": "apply_tri_to_summary",
      "status": "started",
      "timestamp": "2026-05-15T03:54:56.423Z",
      "summary": "apply_tri_to_summary started",
      "staging_path": "/home/runner/work/fanwan-ai.github.io/fanwan-ai.github.io/data/ai/modelswatch/tri_cache.staging.json",
      "cache_path": "/home/runner/work/fanwan-ai.github.io/fanwan-ai.github.io/data/ai/modelswatch/summary_cache.json",
      "accepted": 3,
      "skipped": 10
    },
    {
      "run_id": "apply-tri-2026-05-15-20260515035456.-0bb5383d",
      "step": "apply_tri_to_summary",
      "status": "success",
      "timestamp": "2026-05-15T03:54:56.563Z",
      "summary": "apply_tri_to_summary completed",
      "merged": [
        "github:roboflow/supervision",
        "github:NVIDIA-AI-Blueprints/video-search-and-summarization",
        "huggingface:Qwen/Qwen3.6-27B"
      ],
      "skipped": [
        {
          "canonical_id": "github:obra/superpowers",
          "promptHash": "sha256:2ecb10e3bc6e2683a79fc1849d924280e7606fea7342eedd167ee77364665278",
          "reason": "status_not_ok"
        },
        {
          "canonical_id": "github:Genymobile/scrcpy",
          "promptHash": "sha256:8618468957e28f3d744ecf2a519814ffe3c5b93a0570924946c5d790a6d29400",
          "reason": "status_not_ok"
        },
        {
          "canonical_id": "github:codecrafters-io/build-your-own-x",
          "promptHash": "sha256:f0cc453408c52590c9c95e035339467922e740d334a51760d2024391693233ee",
          "reason": "status_not_ok"
        },
        {
          "canonical_id": "github:sindresorhus/awesome",
          "promptHash": "sha256:2724fb8aae725474927df4f6b45de69bae28d10fbcf1a45f9da35c228ebe25de",
          "reason": "status_not_ok"
        },
        {
          "canonical_id": "github:freeCodeCamp/freeCodeCamp",
          "promptHash": "sha256:7ce99892d88148e7d5cae0b4fc07936e1c16cb26ec455fb4ce856749a954c941",
          "reason": "status_not_ok"
        },
        {
          "canonical_id": "huggingface:sentence-transformers/all-MiniLM-L6-v2",
          "promptHash": "sha256:8ca19d098c0d5ea46046da1c9f3b1a75106bb839b2c9e9dd8eef54e1c97f811a",
          "reason": "status_not_ok"
        },
        {
          "canonical_id": "huggingface:Qwen/Qwen3-VL-2B-Instruct",
          "promptHash": "sha256:032889889a590cbf5c2557d80b343dfca5c96f44bb033b0997a940ef37fd203f",
          "reason": "status_not_ok"
        },
        {
          "canonical_id": "huggingface:google-bert/bert-base-uncased",
          "promptHash": "sha256:103bf1cded07197c1a0c664f6dcb115c0d0822e3d00b7dfad50034a8b7a28f29",
          "reason": "status_not_ok"
        },
        {
          "canonical_id": "huggingface:google/electra-base-discriminator",
          "promptHash": "sha256:b7a35829f521c4fdcddf87805ac9f16ebd258cc548173cdfb983730156ddf6b9",
          "reason": "status_not_ok"
        },
        {
          "canonical_id": "huggingface:cross-encoder/ms-marco-MiniLM-L6-v2",
          "promptHash": "sha256:e870990c5b3a25ae59fcf44e1245c0641a539ed34ccc7b8fa7795cfff5731ee3",
          "reason": "status_not_ok"
        }
      ],
      "unchanged": [],
      "backup": "/home/runner/work/fanwan-ai.github.io/fanwan-ai.github.io/data/ai/modelswatch/summary_cache.json.bak.2026-05-15T03-54-56-462Z.gz",
      "archive": "/home/runner/work/fanwan-ai.github.io/fanwan-ai.github.io/data/ai/modelswatch/tri_cache.archive/2026-05-15-apply-tri-2026-05-15-20260515035456.-0bb5383d.json.gz"
    }
  ]
}
