{
  "schema_version": 1,
  "pipeline_version": "v6",
  "date": "2026-01-14",
  "entries": [
    {
      "run_id": "daily-2026-01-14-20260114031306.-6621ee4b",
      "step": "daily",
      "status": "started",
      "timestamp": "2026-01-14T03:13:07.071Z",
      "summary": "daily stage started"
    },
    {
      "run_id": "daily-2026-01-14-20260114031306.-6621ee4b",
      "step": "daily",
      "status": "success",
      "timestamp": "2026-01-14T03:13:30.280Z",
      "summary": "daily stage completed",
      "metrics": {
        "github_total": 11,
        "github_pending": 11,
        "github_removed_qualified": 109,
        "github_removed_duplicates": 0,
        "hf_total": 6,
        "hf_pending": 6,
        "hf_removed_qualified": 134,
        "hf_removed_duplicates": 0,
        "plan_github_multiplier": 3,
        "plan_github_targets": 0,
        "plan_hf_multiplier": 3,
        "plan_hf_targets": 0
      },
      "artifacts": [
        "raw_corpus.gh.json",
        "raw_corpus.hf.json",
        "2026-01-14.github.draft.json",
        "2026-01-14.hf.draft.json",
        "daily_temp_data/2026-01-14_unqualified_gh.json",
        "daily_temp_data/2026-01-14_unqualified_hf.json",
        "daily_temp_data/2026-01-14_pending_summaries.json"
      ],
      "plan_summary": {
        "generated_at": "2026-01-13T03:14:16.849Z",
        "github": {
          "deficit": 8,
          "limit_multiplier": 3,
          "focus": [
            "mlops_monitoring",
            "optimization_compilers",
            "security_safety",
            "data_tooling",
            "deployment_serving",
            "edge_embedded",
            "agents_workflows",
            "framework_core"
          ],
          "targeted": 6
        },
        "huggingface": {
          "deficit": 8,
          "limit_multiplier": 3,
          "focus": [
            "3d_reconstruction",
            "adversarial_attack",
            "adversarial_defense",
            "ai_ethics_risk_assessment",
            "ar_vr_interaction",
            "asr",
            "auto_evaluation_models",
            "avsr"
          ],
          "targeted": 8
        },
        "notes": [
          "GitHub categories needing coverage: mlops_monitoring, optimization_compilers, security_safety, data_tooling, deployment_serving, edge_embedded, agents_workflows, framework_core",
          "Hugging Face task gaps: 3d_reconstruction, adversarial_attack, adversarial_defense, ai_ethics_risk_assessment, ar_vr_interaction, asr, auto_evaluation_models, avsr"
        ]
      }
    },
    {
      "run_id": "tri-worker-2026-01-14-20260114031624.-47e9564f",
      "step": "tri_worker",
      "status": "started",
      "timestamp": "2026-01-14T03:16:24.366Z",
      "summary": "tri worker started",
      "pending_path": "/home/runner/work/fanwan-ai.github.io/fanwan-ai.github.io/data/ai/modelswatch/daily_temp_data/2026-01-14_pending_summaries.json",
      "queue_size": 17,
      "limit": 300
    },
    {
      "run_id": "tri-worker-2026-01-14-20260114031624.-47e9564f",
      "step": "tri_worker",
      "status": "success",
      "timestamp": "2026-01-14T03:17:07.695Z",
      "summary": "tri worker completed",
      "pending_path": "/home/runner/work/fanwan-ai.github.io/fanwan-ai.github.io/data/ai/modelswatch/daily_temp_data/2026-01-14_pending_summaries.json",
      "artifacts": [
        "tri_cache.staging.json"
      ],
      "stats": {
        "pending_before": 17,
        "pending_after": 10,
        "attempted": 17,
        "succeeded": 7,
        "failed": 0,
        "skipped": 10
      },
      "tri_diagnostics": {
        "cache_hits": 0,
        "cache_misses": 7,
        "total": 7,
        "ok_count": 7,
        "json_path_count": 7,
        "seq_path_count": 0,
        "warnings_total": 11,
        "errors_total": 0,
        "elapsed_sec": 43.112,
        "started_at": 1768360584.5314724,
        "finished_at": 1768360627.6433296,
        "persist_enabled": true,
        "persist_file": "data/ai/modelswatch/tri_cache.json"
      }
    },
    {
      "run_id": "apply-tri-2026-01-14-20260114031707.-d017f231",
      "step": "apply_tri_to_summary",
      "status": "started",
      "timestamp": "2026-01-14T03:17:07.874Z",
      "summary": "apply_tri_to_summary started",
      "staging_path": "/home/runner/work/fanwan-ai.github.io/fanwan-ai.github.io/data/ai/modelswatch/tri_cache.staging.json",
      "cache_path": "/home/runner/work/fanwan-ai.github.io/fanwan-ai.github.io/data/ai/modelswatch/summary_cache.json",
      "accepted": 7,
      "skipped": 10
    },
    {
      "run_id": "apply-tri-2026-01-14-20260114031707.-d017f231",
      "step": "apply_tri_to_summary",
      "status": "success",
      "timestamp": "2026-01-14T03:17:07.958Z",
      "summary": "apply_tri_to_summary completed",
      "merged": [
        "github:blakeblackshear/frigate",
        "github:onlook-dev/onlook",
        "github:chidiwilliams/buzz",
        "github:icloud-photos-downloader/icloud_photos_downloader",
        "github:Free-TV/IPTV",
        "github:adam-maj/tiny-gpu",
        "huggingface:autogluon/chronos-2-small"
      ],
      "skipped": [
        {
          "canonical_id": "github:codecrafters-io/build-your-own-x",
          "promptHash": "sha256:f0cc453408c52590c9c95e035339467922e740d334a51760d2024391693233ee",
          "reason": "status_not_ok"
        },
        {
          "canonical_id": "github:freeCodeCamp/freeCodeCamp",
          "promptHash": "sha256:7ce99892d88148e7d5cae0b4fc07936e1c16cb26ec455fb4ce856749a954c941",
          "reason": "status_not_ok"
        },
        {
          "canonical_id": "github:sindresorhus/awesome",
          "promptHash": "sha256:2724fb8aae725474927df4f6b45de69bae28d10fbcf1a45f9da35c228ebe25de",
          "reason": "status_not_ok"
        },
        {
          "canonical_id": "github:public-apis/public-apis",
          "promptHash": "sha256:2f7e803145c8932a8d3a6af2351a8c66d6db19e0b3d661aba966423d3b32968f",
          "reason": "status_not_ok"
        },
        {
          "canonical_id": "github:EbookFoundation/free-programming-books",
          "promptHash": "sha256:f498b06b6c0acc167c4862603584f4df565b0c479f8ee125ddcb7f6ddcef5d05",
          "reason": "status_not_ok"
        },
        {
          "canonical_id": "huggingface:sentence-transformers/all-MiniLM-L6-v2",
          "promptHash": "sha256:8ca19d098c0d5ea46046da1c9f3b1a75106bb839b2c9e9dd8eef54e1c97f811a",
          "reason": "status_not_ok"
        },
        {
          "canonical_id": "huggingface:google/electra-base-discriminator",
          "promptHash": "sha256:b7a35829f521c4fdcddf87805ac9f16ebd258cc548173cdfb983730156ddf6b9",
          "reason": "status_not_ok"
        },
        {
          "canonical_id": "huggingface:Falconsai/nsfw_image_detection",
          "promptHash": "sha256:99eb3455f132a5daa0b74321d39efa65c6809414abe9e770c4103364cd72c767",
          "reason": "status_not_ok"
        },
        {
          "canonical_id": "huggingface:google-bert/bert-base-uncased",
          "promptHash": "sha256:103bf1cded07197c1a0c664f6dcb115c0d0822e3d00b7dfad50034a8b7a28f29",
          "reason": "status_not_ok"
        },
        {
          "canonical_id": "huggingface:FacebookAI/roberta-large",
          "promptHash": "sha256:741e4e6e85639aa6ec7cf5909873672a20b4ad886817665d2ad3f4cd419a4176",
          "reason": "status_not_ok"
        }
      ],
      "unchanged": [],
      "backup": "/home/runner/work/fanwan-ai.github.io/fanwan-ai.github.io/data/ai/modelswatch/summary_cache.json.bak.2026-01-14T03-17-07-900Z.gz",
      "archive": "/home/runner/work/fanwan-ai.github.io/fanwan-ai.github.io/data/ai/modelswatch/tri_cache.archive/2026-01-14-apply-tri-2026-01-14-20260114031707.-d017f231.json.gz"
    }
  ]
}
