{
  "schema_version": 1,
  "pipeline_version": "v6",
  "date": "2026-07-01",
  "entries": [
    {
      "run_id": "daily-2026-07-01-20260701035257.-01cbc245",
      "step": "daily",
      "status": "started",
      "timestamp": "2026-07-01T03:52:57.849Z",
      "summary": "daily stage started"
    },
    {
      "run_id": "daily-2026-07-01-20260701035257.-01cbc245",
      "step": "daily",
      "status": "success",
      "timestamp": "2026-07-01T03:53:25.807Z",
      "summary": "daily stage completed",
      "metrics": {
        "github_total": 17,
        "github_pending": 17,
        "github_removed_qualified": 103,
        "github_removed_duplicates": 0,
        "hf_total": 5,
        "hf_pending": 5,
        "hf_removed_qualified": 135,
        "hf_removed_duplicates": 0,
        "plan_github_multiplier": 3,
        "plan_github_targets": 0,
        "plan_hf_multiplier": 3,
        "plan_hf_targets": 0
      },
      "artifacts": [
        "raw_corpus.gh.json",
        "raw_corpus.hf.json",
        "2026-07-01.github.draft.json",
        "2026-07-01.hf.draft.json",
        "daily_temp_data/2026-07-01_unqualified_gh.json",
        "daily_temp_data/2026-07-01_unqualified_hf.json",
        "daily_temp_data/2026-07-01_pending_summaries.json"
      ],
      "plan_summary": {
        "generated_at": "2026-06-29T04:08:07.224Z",
        "github": {
          "deficit": 8,
          "limit_multiplier": 3,
          "focus": [
            "agents_workflows",
            "deployment_serving",
            "framework_core",
            "optimization_compilers",
            "security_safety",
            "edge_embedded",
            "mlops_monitoring",
            "data_tooling"
          ],
          "targeted": 6
        },
        "huggingface": {
          "deficit": 8,
          "limit_multiplier": 3,
          "focus": [
            "3d_reconstruction",
            "adversarial_attack",
            "adversarial_defense",
            "ai_ethics_risk_assessment",
            "ar_vr_interaction",
            "asr",
            "auto_evaluation_models",
            "avsr"
          ],
          "targeted": 8
        },
        "notes": [
          "GitHub categories needing coverage: agents_workflows, deployment_serving, framework_core, optimization_compilers, security_safety, edge_embedded, mlops_monitoring, data_tooling",
          "Hugging Face task gaps: 3d_reconstruction, adversarial_attack, adversarial_defense, ai_ethics_risk_assessment, ar_vr_interaction, asr, auto_evaluation_models, avsr"
        ]
      }
    },
    {
      "run_id": "tri-worker-2026-07-01-20260701035951.-b1e85af2",
      "step": "tri_worker",
      "status": "started",
      "timestamp": "2026-07-01T03:59:51.254Z",
      "summary": "tri worker started",
      "pending_path": "/home/runner/work/fanwan-ai.github.io/fanwan-ai.github.io/data/ai/modelswatch/daily_temp_data/2026-07-01_pending_summaries.json",
      "queue_size": 22,
      "limit": 300
    },
    {
      "run_id": "tri-worker-2026-07-01-20260701035951.-b1e85af2",
      "step": "tri_worker",
      "status": "success",
      "timestamp": "2026-07-01T04:01:03.446Z",
      "summary": "tri worker completed",
      "pending_path": "/home/runner/work/fanwan-ai.github.io/fanwan-ai.github.io/data/ai/modelswatch/daily_temp_data/2026-07-01_pending_summaries.json",
      "artifacts": [
        "tri_cache.staging.json"
      ],
      "stats": {
        "pending_before": 22,
        "pending_after": 10,
        "attempted": 22,
        "succeeded": 12,
        "failed": 0,
        "skipped": 10
      },
      "tri_diagnostics": {
        "cache_hits": 0,
        "cache_misses": 12,
        "total": 12,
        "ok_count": 12,
        "json_path_count": 12,
        "seq_path_count": 2,
        "warnings_total": 23,
        "errors_total": 2,
        "elapsed_sec": 71.808,
        "started_at": 1782878391.56719,
        "finished_at": 1782878463.3755906,
        "persist_enabled": true,
        "persist_file": "data/ai/modelswatch/tri_cache.json"
      }
    },
    {
      "run_id": "apply-tri-2026-07-01-20260701040103.-b4e2df8f",
      "step": "apply_tri_to_summary",
      "status": "started",
      "timestamp": "2026-07-01T04:01:03.662Z",
      "summary": "apply_tri_to_summary started",
      "staging_path": "/home/runner/work/fanwan-ai.github.io/fanwan-ai.github.io/data/ai/modelswatch/tri_cache.staging.json",
      "cache_path": "/home/runner/work/fanwan-ai.github.io/fanwan-ai.github.io/data/ai/modelswatch/summary_cache.json",
      "accepted": 11,
      "skipped": 11
    },
    {
      "run_id": "apply-tri-2026-07-01-20260701040103.-b4e2df8f",
      "step": "apply_tri_to_summary",
      "status": "success",
      "timestamp": "2026-07-01T04:01:03.821Z",
      "summary": "apply_tri_to_summary completed",
      "merged": [
        "github:microsoft/AI-For-Beginners",
        "github:HKUDS/Vibe-Trading",
        "github:browser-use/video-use",
        "github:ogulcancelik/herdr",
        "github:Robbyant/lingbot-map",
        "github:xbtlin/ai-berkshire",
        "github:hasaneyldrm/exercises-dataset",
        "github:altic-dev/FluidVoice",
        "github:google/agents-cli",
        "github:facebook/astryx",
        "github:CoreBunch/Instatic"
      ],
      "skipped": [
        {
          "canonical_id": "github:diegosouzapw/OmniRoute",
          "promptHash": "sha256:fd1019deb202dfe5c7d03b5cc589c9e71b2e8e1a580b8ab928c395fc7348cd8e",
          "reason": "fallback_flagged"
        },
        {
          "canonical_id": "github:obra/superpowers",
          "promptHash": "sha256:20e5f82308f3c932e152ab20f412320dfdbd0f7430bd9dd13b815e6f357fdd03",
          "reason": "status_not_ok"
        },
        {
          "canonical_id": "github:ripienaar/free-for-dev",
          "promptHash": "sha256:f16bf6481e613a57d74d48ace87ca69229efdcc6207e7922d89f6e9ef8598008",
          "reason": "status_not_ok"
        },
        {
          "canonical_id": "github:msitarzewski/agency-agents",
          "promptHash": "sha256:39afd130396ec0d4d8132a959ef72932eea62911d8c8f7009d769c387bfd737f",
          "reason": "status_not_ok"
        },
        {
          "canonical_id": "github:codecrafters-io/build-your-own-x",
          "promptHash": "sha256:f0cc453408c52590c9c95e035339467922e740d334a51760d2024391693233ee",
          "reason": "status_not_ok"
        },
        {
          "canonical_id": "github:sindresorhus/awesome",
          "promptHash": "sha256:2724fb8aae725474927df4f6b45de69bae28d10fbcf1a45f9da35c228ebe25de",
          "reason": "status_not_ok"
        },
        {
          "canonical_id": "huggingface:sentence-transformers/all-MiniLM-L6-v2",
          "promptHash": "sha256:8ca19d098c0d5ea46046da1c9f3b1a75106bb839b2c9e9dd8eef54e1c97f811a",
          "reason": "status_not_ok"
        },
        {
          "canonical_id": "huggingface:cross-encoder/ms-marco-MiniLM-L6-v2",
          "promptHash": "sha256:e870990c5b3a25ae59fcf44e1245c0641a539ed34ccc7b8fa7795cfff5731ee3",
          "reason": "status_not_ok"
        },
        {
          "canonical_id": "huggingface:google-bert/bert-base-uncased",
          "promptHash": "sha256:103bf1cded07197c1a0c664f6dcb115c0d0822e3d00b7dfad50034a8b7a28f29",
          "reason": "status_not_ok"
        },
        {
          "canonical_id": "huggingface:BAAI/bge-small-en-v1.5",
          "promptHash": "sha256:5ed6cb6fb5aa934e43677a957100253b7a8572eaddddcf9750de5c99dd45f1f3",
          "reason": "status_not_ok"
        },
        {
          "canonical_id": "huggingface:sentence-transformers/paraphrase-multilingual-MiniLM-L12-v2",
          "promptHash": "sha256:44bbd0a9704390ac4236b71663254047d3c457959e94c1f976bfeb2db4d5c489",
          "reason": "status_not_ok"
        }
      ],
      "unchanged": [],
      "backup": "/home/runner/work/fanwan-ai.github.io/fanwan-ai.github.io/data/ai/modelswatch/summary_cache.json.bak.2026-07-01T04-01-03-708Z.gz",
      "archive": "/home/runner/work/fanwan-ai.github.io/fanwan-ai.github.io/data/ai/modelswatch/tri_cache.archive/2026-07-01-apply-tri-2026-07-01-20260701040103.-b4e2df8f.json.gz"
    }
  ]
}
